{
  "schema_version": 1,
  "run_id": "2026-08-17-po-cr-004-c-pilot-002",
  "task_id": "PO-CR-004",
  "variant": "C",
  "repository_commit": "c1f7942cca5c2af574ccbe5775a71179e96c9c9f",
  "started_at": "2026-08-17T20:45:25.8309791+08:00",
  "ended_at": "2026-08-17T20:45:49.3885349+08:00",
  "execution": {
    "model": null,
    "harness": "Codex desktop (user-operated)",
    "toolchain": "context-routing pilot-002 prompt packet v1",
    "permission_profile": null,
    "prompt_revision": "po-cr-004-pilot-002-v1",
    "prompt_sha256": "5273eaccc3291223d90407d4e9681538ca4b5e30e73e31fd4d89e4c4776b5dd1",
    "external_context_policy": "repository_only",
    "operator_interventions": []
  },
  "events": [
    { "sequence": 1, "timestamp": "2026-08-17T20:45:25.8309791+08:00", "event_type": "command", "observed_by": "agent", "target_scope": "command", "target": "Get-Date -Format o", "reason_code": "run-start" },
    { "sequence": 2, "timestamp": null, "event_type": "content_read", "observed_by": "agent", "target_scope": "repository", "target": "README.md", "reason_code": "manifest-initial-selected-evidence" },
    { "sequence": 3, "timestamp": null, "event_type": "write", "observed_by": "agent", "target_scope": "repository", "target": "README.md", "reason_code": "task-target" },
    { "sequence": 4, "timestamp": null, "event_type": "command", "observed_by": "agent", "target_scope": "command", "target": "git status --short", "reason_code": "scope-validation" },
    { "sequence": 5, "timestamp": null, "event_type": "test", "observed_by": "agent", "target_scope": "command", "target": "git diff --check", "reason_code": "validation" },
    { "sequence": 6, "timestamp": null, "event_type": "command", "observed_by": "agent", "target_scope": "command", "target": "git diff -- README.md", "reason_code": "validation" },
    { "sequence": 7, "timestamp": null, "event_type": "command", "observed_by": "agent", "target_scope": "command", "target": "git diff --name-only", "reason_code": "scope-validation" },
    { "sequence": 8, "timestamp": null, "event_type": "test", "observed_by": "agent", "target_scope": "command", "target": "python -m unittest discover -s tests -v", "reason_code": "validation" },
    { "sequence": 9, "timestamp": "2026-08-17T20:45:49.3885349+08:00", "event_type": "command", "observed_by": "agent", "target_scope": "command", "target": "Get-Date -Format o", "reason_code": "run-end" },
    { "sequence": 10, "timestamp": "2026-08-17T21:02:03.1105061+08:00", "event_type": "test", "observed_by": "tool_wrapper", "target_scope": "external", "target": "external://pilot-002/operator/PROMPT-C.zh-CN.md", "reason_code": "prompt-sha256-verification" },
    { "sequence": 11, "timestamp": "2026-08-17T21:02:03.1105061+08:00", "event_type": "test", "observed_by": "tool_wrapper", "target_scope": "repository", "target": ".codex/config.toml", "reason_code": "overlay-sha256-verification" },
    { "sequence": 12, "timestamp": "2026-08-17T21:02:03.1105061+08:00", "event_type": "test", "observed_by": "tool_wrapper", "target_scope": "command", "target": "git diff --check", "reason_code": "post-run-evaluation" },
    { "sequence": 13, "timestamp": "2026-08-17T21:02:03.1105061+08:00", "event_type": "command", "observed_by": "tool_wrapper", "target_scope": "command", "target": "git diff --name-only", "reason_code": "post-run-evaluation" },
    { "sequence": 14, "timestamp": "2026-08-17T21:02:03.1105061+08:00", "event_type": "test", "observed_by": "tool_wrapper", "target_scope": "command", "target": "python -m unittest discover -s tests -v", "reason_code": "post-run-evaluation" },
    { "sequence": 15, "timestamp": "2026-08-17T21:02:03.1105061+08:00", "event_type": "command", "observed_by": "tool_wrapper", "target_scope": "external", "target": "external://historical-reference/PO-CR-004/README.md", "reason_code": "reference-comparison" }
  ],
  "metrics": {
    "input_tokens": null,
    "output_tokens": null,
    "wall_time_seconds": 23.557556,
    "provider_cost": null,
    "documents_touched": 1,
    "documentation_sync_seconds": null,
    "conflict_warning_delay_seconds": null
  },
  "artifacts": {
    "changed_paths": ["README.md"],
    "diff_git_oid": "ac80294b7a34a32791dabc2167b574df33b3da1e"
  },
  "outcome": {
    "task_accepted": true,
    "validation_passed": true,
    "missed_dependencies": 0,
    "irrelevant_reads": null,
    "necessary_reads_missed": 0,
    "scope_expansions": null,
    "notes": "The README retains manual copying and adds the canonical GitHub Skill path through $skill-installer while preserving the installation-versus-adoption boundary. One repository content read was reported. The final summary only condenses the Context Manifest and selected evidence, so their pre-write completeness cannot be independently reviewed from the supplied report alone."
  },
  "evaluation": {
    "reference_match": "functional",
    "apparatus_valid": null,
    "confounds": [
      "agent_self_report_only_for_original_read_events",
      "external_context_preflight_not_independently_observed",
      "harness_overlay_effect_not_independently_logged",
      "model_reasoning_permission_metadata_not_captured",
      "agent_timestamps_not_independently_observed",
      "prewrite_manifest_transcript_not_supplied",
      "token_and_provider_cost_metrics_unavailable"
    ],
    "notes": "Prompt SHA, overlay SHA, changed paths, diff validity, tests, and reference comparison were independently checked. The run is conditionally comparable at the repository boundary, but apparatus validity remains unknown until execution-profile equivalence, the pre-write Manifest transcript, and model-facing content access can be independently established."
  }
}
