{
  "schema_version": 1,
  "run_id": "2026-08-17-po-cr-004-c-pilot-001",
  "task_id": "PO-CR-004",
  "variant": "C",
  "repository_commit": "4e16f81494faf142db81a803f0a7df59aa7ef8ec",
  "started_at": null,
  "ended_at": null,
  "execution": {
    "model": null,
    "harness": "Codex desktop (user-operated)",
    "toolchain": "context-routing pilot prompt v1",
    "permission_profile": null,
    "prompt_revision": "po-cr-004-pilot-001-v1",
    "prompt_sha256": null,
    "external_context_policy": "uncontrolled",
    "operator_interventions": []
  },
  "events": [
    { "sequence": 1, "timestamp": null, "event_type": "content_read", "observed_by": "agent", "target_scope": "external", "target": "external://codex-skills/project-orrery/SKILL.md", "reason_code": "manifest-initial" },
    { "sequence": 2, "timestamp": null, "event_type": "enumerate", "observed_by": "agent", "target_scope": "query", "target": "rg --files -g '!*.git*'", "reason_code": "task-localization" },
    { "sequence": 3, "timestamp": null, "event_type": "search", "observed_by": "agent", "target_scope": "query", "target": "README headings and install|Codex|skill|safe|adopt|curl|git clone|npx|pip", "reason_code": "selective-localization" },
    { "sequence": 4, "timestamp": null, "event_type": "content_read", "observed_by": "agent", "target_scope": "repository", "target": "README.md", "reason_code": "selected-evidence-partial" },
    { "sequence": 5, "timestamp": null, "event_type": "scope_expand", "observed_by": "agent", "target_scope": "external", "target": "external://codex-system/skill-installer/SKILL.md", "reason_code": "missing-rule" },
    { "sequence": 6, "timestamp": null, "event_type": "content_read", "observed_by": "agent", "target_scope": "external", "target": "external://codex-system/skill-installer/SKILL.md", "reason_code": "missing-rule" },
    { "sequence": 7, "timestamp": null, "event_type": "command", "observed_by": "agent", "target_scope": "command", "target": "git remote get-url origin", "reason_code": "repository-identity" },
    { "sequence": 8, "timestamp": null, "event_type": "content_read", "observed_by": "agent", "target_scope": "repository", "target": ".git/config", "reason_code": "undeclared-repository-identity-read" },
    { "sequence": 9, "timestamp": null, "event_type": "write", "observed_by": "agent", "target_scope": "repository", "target": "README.md", "reason_code": "task-target" },
    { "sequence": 10, "timestamp": null, "event_type": "test", "observed_by": "agent", "target_scope": "command", "target": "git diff --check", "reason_code": "validation" },
    { "sequence": 11, "timestamp": null, "event_type": "test", "observed_by": "agent", "target_scope": "command", "target": "python -m unittest tests.test_project_orrery", "reason_code": "validation" },
    { "sequence": 12, "timestamp": null, "event_type": "command", "observed_by": "agent", "target_scope": "command", "target": "README PowerShell content assertions", "reason_code": "validation" },
    { "sequence": 13, "timestamp": null, "event_type": "command", "observed_by": "agent", "target_scope": "command", "target": "git diff --name-only", "reason_code": "scope-validation" },
    { "sequence": 14, "timestamp": "2026-08-17T20:11:32.3614642+08:00", "event_type": "test", "observed_by": "tool_wrapper", "target_scope": "command", "target": "git diff --check", "reason_code": "post-run-evaluation" },
    { "sequence": 15, "timestamp": "2026-08-17T20:11:32.3614642+08:00", "event_type": "test", "observed_by": "tool_wrapper", "target_scope": "command", "target": "python -m unittest discover -s tests -v", "reason_code": "post-run-evaluation" },
    { "sequence": 16, "timestamp": "2026-08-17T20:11:32.3614642+08:00", "event_type": "command", "observed_by": "tool_wrapper", "target_scope": "command", "target": "git diff --name-only", "reason_code": "post-run-evaluation" },
    { "sequence": 17, "timestamp": "2026-08-17T20:11:32.3614642+08:00", "event_type": "command", "observed_by": "tool_wrapper", "target_scope": "command", "target": "rg -n github.com README.md", "reason_code": "post-run-evaluation" }
  ],
  "metrics": {
    "input_tokens": null,
    "output_tokens": null,
    "wall_time_seconds": null,
    "provider_cost": null,
    "documents_touched": 1,
    "documentation_sync_seconds": null,
    "conflict_warning_delay_seconds": null
  },
  "artifacts": {
    "changed_paths": ["README.md"],
    "diff_git_oid": "95062fdbec2af16bd6754f612c57e7a5818298ce"
  },
  "outcome": {
    "task_accepted": false,
    "validation_passed": true,
    "missed_dependencies": null,
    "irrelevant_reads": null,
    "necessary_reads_missed": null,
    "scope_expansions": 1,
    "notes": "The change was syntactically valid and limited to README.md. It did not invent an owner, but the <owner>/<repository> placeholder was not directly usable. The Agent reported only one expansion even though .git/config was also read outside its initial Manifest."
  },
  "evaluation": {
    "reference_match": "partial",
    "apparatus_valid": false,
    "confounds": [
      "public_repository_identity_missing_from_prompt_and_baseline",
      "installed_project_orrery_skill_exposed_future_context",
      "undeclared_git_config_scope_expansion",
      "agent_self_report_only_for_original_read_events",
      "timing_and_token_metrics_unavailable"
    ],
    "notes": "The smallest reported content set and conservative handling of missing identity are promising signals, but the undeclared metadata read and future Skill leakage prevent a valid performance conclusion."
  }
}
